"BROKEN","EPIC","FAILED","FEATURE","PASSED","SKIPPED","STORY","UNKNOWN"
"0","","0","Product","1","0","Search of the product on the product page","0"
"0","","0","Other functionalities","1","0","Contact Us Form Submission","0"
"0","","0","Login & Authentication","1","0","Signup and deleting user","0"
"0","","0","Products","1","0","Verify product list and product details visibility","0"
"0","","0","Login & Authentication","1","0","Logout","0"
"0","","0","Other functionalities","1","0","Subscribing to the newsletter from the home page","0"
"0","","0","Login & Authentication","1","0","Login with valid credentials","0"
"0","","0","Other functionalities","1","0","Verifying the test cases page visibility","0"
"0","","0","Login & Authentication","1","0","Login with Invalid Credentials","0"
"0","","0","Login & Authentication","1","0","Signup using the email that is already in the system","0"
